{
  "$schema": "http://json-schema.org/draft-04/schema#",
  "type": "object",
  "properties": {
    "title": {
      "type": "string"
    },
    "description": {
      "type": "string"
    },
    "price": {
      "type": "number"
    },
    "discountPercentage": {
      "type": "number"
    },
    "rating": {
      "type": "number"
    },
    "stock": {
      "type": "integer"
    },
    "brand": {
      "type": "string"
    },
    "category": {
      "type": "string"
    },
    "thumbnail": {
      "type": "string"
    },
    "images": {
      "type": "array",
      "items": [
        {
          "type": "string"
        },
        {
          "type": "string"
        },
        {
          "type": "string"
        },
        {
          "type": "string"
        },
        {
          "type": "string"
        }
      ]
    }
  }
}